{
  "schema_version": "1.0",
  "run": {
    "mode": "lab",
    "language": "en",
    "created_at": "2026-07-25"
  },
  "product": {
    "name": "Reusable Fabric Sweeper",
    "category": "household cleaning",
    "source_rights": "owned",
    "source_summary": "Owned seller brief and observable product demonstration notes; no reviews, offer, competitor footage, or performance metrics supplied."
  },
  "audience": {
    "persona": "Pet owners with dark fabric furniture",
    "context": "They notice visible loose hair while preparing the room for guests.",
    "pain": "Loose pet hair makes a recently cleaned room look unfinished.",
    "desire": "A reusable, easy-to-empty tool for routine touch-ups.",
    "awareness_stage": "problem-aware",
    "is_inferred": false
  },
  "objective": {
    "platform": "TikTok Shop",
    "aspect_ratio": "9:16",
    "duration_seconds": 15,
    "goal": "hold"
  },
  "facts": [
    {
      "id": "F01",
      "kind": "feature",
      "statement": "The handheld manual tool gathers visible loose pet hair from woven fabric during the seller's demonstration.",
      "source_locator": "Owned product brief, observable product facts, bullet 1",
      "status": "verified",
      "visual_proof": "One continuous real-footage pass over a dark woven cushion.",
      "requires_human_review": false,
      "required_companion_ids": [
        "R01"
      ]
    },
    {
      "id": "F02",
      "kind": "mechanism",
      "statement": "Collected hair moves into an internal chamber.",
      "source_locator": "Owned product brief, observable product facts, bullet 2",
      "status": "verified",
      "visual_proof": "Open the chamber after the pass and show the collected hair.",
      "requires_human_review": false,
      "required_companion_ids": []
    },
    {
      "id": "F03",
      "kind": "feature",
      "statement": "The tool uses no disposable adhesive sheets.",
      "source_locator": "Owned product brief, observable product facts, bullet 4",
      "status": "verified",
      "visual_proof": "Place an empty disposable roll beside the reusable tool without making universal superiority claims.",
      "requires_human_review": false,
      "required_companion_ids": []
    },
    {
      "id": "F04",
      "kind": "usage",
      "statement": "The tool can be used again after the chamber is emptied.",
      "source_locator": "Owned product brief, observable product facts, bullet 5",
      "status": "verified",
      "visual_proof": "Empty the chamber and begin a second real pass.",
      "requires_human_review": false,
      "required_companion_ids": []
    },
    {
      "id": "F05",
      "kind": "mechanism",
      "statement": "The chamber opens so the collected hair can be removed.",
      "source_locator": "Owned product brief, observable product facts, bullet 3",
      "status": "verified",
      "visual_proof": "Close macro shot of the chamber opening.",
      "requires_human_review": false,
      "required_companion_ids": []
    },
    {
      "id": "R01",
      "kind": "restriction",
      "statement": "Do not claim that one pass removes all hair or that the tool works on every fabric.",
      "source_locator": "Owned product brief, limitations, bullets 1-2",
      "status": "verified",
      "visual_proof": "Keep the real surface visible and use qualified language.",
      "requires_human_review": false,
      "required_companion_ids": []
    },
    {
      "id": "R02",
      "kind": "restriction",
      "statement": "Do not use an AI-generated cleaning result as product proof.",
      "source_locator": "Owned product brief, limitations, bullet 3",
      "status": "prohibited",
      "visual_proof": "Use owned real footage for every performance claim.",
      "requires_human_review": true,
      "required_companion_ids": []
    }
  ],
  "hooks": [
    {
      "id": "H01",
      "angle": "visual-proof",
      "archetype": "direct demonstration",
      "spoken": "This cushion only looks clean.",
      "visual": "One real pass across a dark woven cushion reveals a line of visible loose hair.",
      "text_overlay": "The hidden layer",
      "supporting_fact_ids": [
        "F01",
        "R01"
      ],
      "proof_plan": "Use one continuous owned real-footage pass and keep the actual surface visible.",
      "risk_flags": [],
      "human_review_required": false,
      "scores": {
        "product_relevance": 5,
        "audience_fit": 5,
        "first_frame_clarity": 5,
        "curiosity": 4,
        "proofability": 5,
        "feed_native": 5,
        "model_feasibility": 4,
        "distinctness": 5
      },
      "readiness_score": 4.8,
      "decision": "advance"
    },
    {
      "id": "H02",
      "angle": "pain-moment",
      "archetype": "mid-action cold open",
      "spoken": "Guests are ten minutes away.",
      "visual": "A doorbell alert appears as the creator notices loose hair across a dark sofa.",
      "text_overlay": "Last-minute sofa check",
      "supporting_fact_ids": [
        "F01",
        "R01"
      ],
      "proof_plan": "Use the guest-arrival setup only as context, then show the real product demonstration.",
      "risk_flags": [],
      "human_review_required": false,
      "scores": {
        "product_relevance": 4,
        "audience_fit": 5,
        "first_frame_clarity": 4,
        "curiosity": 4,
        "proofability": 4,
        "feed_native": 5,
        "model_feasibility": 5,
        "distinctness": 4
      },
      "readiness_score": 4.4,
      "decision": "revise"
    },
    {
      "id": "H03",
      "angle": "mechanism",
      "archetype": "open loop",
      "spoken": "Watch where the loose hair goes.",
      "visual": "A macro tracking shot follows loose hair gathering at the tool edge.",
      "text_overlay": "Follow the hair",
      "supporting_fact_ids": [
        "F01",
        "F02",
        "F05",
        "R01"
      ],
      "proof_plan": "Continue the pass without a hidden cut and open the real chamber on camera.",
      "risk_flags": [],
      "human_review_required": false,
      "scores": {
        "product_relevance": 5,
        "audience_fit": 4,
        "first_frame_clarity": 5,
        "curiosity": 4,
        "proofability": 5,
        "feed_native": 4,
        "model_feasibility": 5,
        "distinctness": 5
      },
      "readiness_score": 4.6,
      "decision": "advance"
    },
    {
      "id": "H04",
      "angle": "identity-callout",
      "archetype": "specific question",
      "spoken": "Dark sofa and a light-haired pet?",
      "visual": "A split frame connects the pet's coat with visible loose hair on the cushion.",
      "text_overlay": "Pet-owner contrast",
      "supporting_fact_ids": [
        "F01",
        "R01"
      ],
      "proof_plan": "Use an owned pet image or film a generic pet context, then transition to real product footage.",
      "risk_flags": [
        "likeness-or-voice"
      ],
      "human_review_required": true,
      "scores": {
        "product_relevance": 4,
        "audience_fit": 5,
        "first_frame_clarity": 4,
        "curiosity": 3,
        "proofability": 4,
        "feed_native": 4,
        "model_feasibility": 4,
        "distinctness": 4
      },
      "readiness_score": 4.0,
      "decision": "revise"
    },
    {
      "id": "H05",
      "angle": "routine",
      "archetype": "mid-action cold open",
      "spoken": "My doorbell triggered this cleanup.",
      "visual": "A hand reaches for the sweeper immediately after a doorbell chime.",
      "text_overlay": "Before they sit down",
      "supporting_fact_ids": [
        "F01",
        "R01"
      ],
      "proof_plan": "Keep the setup brief and use the real product for the cleaning action.",
      "risk_flags": [],
      "human_review_required": false,
      "scores": {
        "product_relevance": 4,
        "audience_fit": 4,
        "first_frame_clarity": 4,
        "curiosity": 4,
        "proofability": 4,
        "feed_native": 5,
        "model_feasibility": 5,
        "distinctness": 4
      },
      "readiness_score": 4.2,
      "decision": "revise"
    },
    {
      "id": "H06",
      "angle": "objection-reversal",
      "archetype": "workflow comparison",
      "spoken": "No fresh lint sheet this time.",
      "visual": "An empty disposable lint roll slides aside as the reusable tool enters frame.",
      "text_overlay": "Use it again",
      "supporting_fact_ids": [
        "F03",
        "F04",
        "F05"
      ],
      "proof_plan": "Show the real empty-and-reuse routine without naming a competitor or claiming universal superiority.",
      "risk_flags": [
        "comparison"
      ],
      "human_review_required": true,
      "scores": {
        "product_relevance": 5,
        "audience_fit": 4,
        "first_frame_clarity": 5,
        "curiosity": 4,
        "proofability": 5,
        "feed_native": 5,
        "model_feasibility": 5,
        "distinctness": 5
      },
      "readiness_score": 4.8,
      "decision": "advance"
    },
    {
      "id": "H07",
      "angle": "manual-friction",
      "archetype": "specific question",
      "spoken": "Still picking loose hair off by hand?",
      "visual": "Fingers lift a few visible hairs before the sweeper enters the same frame.",
      "text_overlay": "There is another motion",
      "supporting_fact_ids": [
        "F01",
        "R01"
      ],
      "proof_plan": "Show only observable manual effort, then demonstrate the real tool without time-saving claims.",
      "risk_flags": [],
      "human_review_required": false,
      "scores": {
        "product_relevance": 4,
        "audience_fit": 4,
        "first_frame_clarity": 4,
        "curiosity": 3,
        "proofability": 4,
        "feed_native": 4,
        "model_feasibility": 5,
        "distinctness": 4
      },
      "readiness_score": 4.0,
      "decision": "revise"
    },
    {
      "id": "H08",
      "angle": "unboxing-or-reveal",
      "archetype": "product reveal",